{
    "$schema": "http://json-schema.org/draft-07/schema#",
    "$id": "https://github.com/ibm-openbmc/phosphor-state-manager/redundant-bmc/config-schema.json",
    "title": "Schema for Redundant BMC Configuration Files",
    "description": "Configuration schema for OpenBMC redundant BMC functionality",
    "type": "object",
    "required": ["sibling_bmc_reset_gpio"],
    "properties": {
        "check_passive_bmc_chassis_available": {
            "type": "boolean",
            "description": "Controls whether the active BMC should check the passive BMC's parent chassis Available property before enabling redundancy. Defaults to false if not specified. When true, bmc_configs is required and each BMC config must include parent_chassis_num.",
            "default": false
        },
        "sibling_bmc_reset_gpio": {
            "description": "GPIO configuration for resetting the sibling BMC",
            "$ref": "#/$defs/gpio_config"
        },
        "bmc_configs": {
            "description": "Array of BMC configuration objects. Required when sibling_bmc_present_gpio is necessary or check_passive_bmc_chassis_available is true.",
            "type": "array",
            "items": {
                "$ref": "#/$defs/bmc_config"
            },
            "minItems": 0,
            "uniqueItems": true
        },
        "pcie_config": {
            "description": "PCIe storage configuration for redundancy data. Optional - if not present, PCIe storage functionality is disabled.",
            "$ref": "#/$defs/pcie_config"
        }
    },
    "additionalProperties": false,
    "if": {
        "required": ["check_passive_bmc_chassis_available"],
        "properties": {
            "check_passive_bmc_chassis_available": {
                "const": true
            }
        }
    },
    "then": {
        "required": ["bmc_configs"],
        "properties": {
            "bmc_configs": {
                "minItems": 2
            }
        }
    },
    "$defs": {
        "gpio_config": {
            "type": "object",
            "description": "Configuration for a GPIO line",
            "required": ["name", "polarity"],
            "properties": {
                "name": {
                    "type": "string",
                    "description": "The GPIO line name",
                    "minLength": 1
                },
                "polarity": {
                    "type": "string",
                    "description": "The polarity of the GPIO line. 'low' means active when the GPIO reads low, 'high' means active when the GPIO reads high.",
                    "enum": ["low", "high"]
                }
            },
            "additionalProperties": false
        },
        "bmc_config": {
            "type": "object",
            "description": "Configuration for a single BMC in the redundant system",
            "required": ["bmc_pos"],
            "anyOf": [
                {
                    "required": ["parent_chassis_num"]
                },
                {
                    "required": ["sibling_bmc_present_gpio"]
                }
            ],
            "properties": {
                "bmc_pos": {
                    "type": "integer",
                    "description": "Position/index of this BMC (0-based). Typically 0 or 1 for dual BMC systems.",
                    "minimum": 0
                },
                "parent_chassis_num": {
                    "type": "integer",
                    "description": "The chassis number that is the parent of this BMC. Required when check_passive_bmc_chassis_available is true.",
                    "minimum": 0
                },
                "sibling_bmc_present_gpio": {
                    "description": "GPIO configuration for detecting sibling BMC presence",
                    "$ref": "#/$defs/gpio_config"
                }
            },
            "additionalProperties": false
        },
        "pcie_config": {
            "type": "object",
            "description": "PCIe storage configuration for redundancy data",
            "required": ["device_path", "redundancy_offset"],
            "properties": {
                "device_path": {
                    "type": "string",
                    "description": "Path to the PCIe device (e.g., '/dev/bmc-device0')",
                    "minLength": 1
                },
                "redundancy_offset": {
                    "type": "string",
                    "description": "Offset in the PCIe device for redundancy data as a hex string (e.g., '0x3EFFF80')",
                    "minLength": 1
                }
            },
            "additionalProperties": false
        }
    }
}
